{"schema": "mq.timeline/1", "id": "spotify:track:5lwhEPfBUN3ECthg5EeCg2", "source": "exact", "durationMs": 183693, "createdAt": "2026-10-11T00:00:00.000Z", "generator": "isophonics human annotation, shifted -140 ms", "meter": {"num": 4, "den": 4}, "beats": [100.0, 1010.0, 1970.0, 2930.0, 3890.0, 4870.0, 5840.0, 6750.0, 7700.0, 8620.0, 9560.0, 10500.0, 11380.0, 12270.0, 13240.0, 14150.0, 15070.0, 15950.0, 16880.0, 17810.0, 18730.0, 19620.0, 20540.0, 21440.0, 22390.0, 23290.0, 24230.0, 25140.0, 26080.0, 26980.0, 27920.0, 28840.0, 29740.0, 30620.0, 31510.0, 32410.0, 33320.0, 34210.0, 35180.0, 36100.0, 37010.0, 37960.0, 38910.0, 39820.0, 40770.0, 41720.0, 42650.0, 43550.0, 44450.0, 45330.0, 46280.0, 47140.0, 48080.0, 48990.0, 49920.0, 50810.0, 51750.0, 52640.0, 53530.0, 54420.0, 55350.0, 56270.0, 57240.0, 58120.0, 59000.0, 59860.0, 60780.0, 61690.0, 62590.0, 63480.0, 64380.0, 65280.0, 66200.0, 67070.0, 68030.0, 68940.0, 69870.0, 70790.0, 71740.0, 72650.0, 73570.0, 74460.0, 75330.0, 76170.0, 77040.0, 77870.0, 78740.0, 79570.0, 80420.0, 81280.0, 82130.0, 82960.0, 83810.0, 84660.0, 85530.0, 86410.0, 87260.0, 88130.0, 88990.0, 89810.0, 90670.0, 91490.0, 92350.0, 93180.0, 94010.0, 94860.0, 95710.0, 96530.0, 97380.0, 98230.0, 99060.0, 99930.0, 100810.0, 101690.0, 102620.0, 103530.0, 104440.0, 105340.0, 106260.0, 107150.0, 108010.0, 108860.0, 109770.0, 110660.0, 111590.0, 112490.0, 113360.0, 114260.0, 115120.0, 115960.0, 116870.0, 117790.0, 118690.0, 119600.0, 120490.0, 121380.0, 122300.0, 123200.0, 124090.0, 124980.0, 125870.0, 126730.0, 127590.0, 128480.0, 129340.0, 130230.0, 131130.0, 132040.0, 132930.0, 133840.0, 134760.0, 135670.0, 136590.0, 137500.0, 138420.0, 139330.0, 140230.0, 141130.0, 142070.0, 142980.0, 143870.0, 144760.0, 145680.0, 146580.0, 147430.0, 148300.0, 149190.0, 150120.0, 151030.0, 151940.0, 152850.0, 153750.0, 154640.0, 155510.0, 156420.0, 157320.0, 158200.0, 159100.0, 160000.0, 160890.0, 161800.0, 162700.0, 163620.0, 164530.0, 165440.0, 166330.0, 167250.0, 168130.0, 168980.0, 169830.0, 170740.0, 171650.0, 172620.0, 173640.0], "bars": [], "chords": [{"startMs": 0, "endMs": 1123.7, "symbol": "N.C.", "harte": "N"}, {"startMs": 1123.7, "endMs": 2982.8, "symbol": "F", "harte": "F"}, {"startMs": 2982.8, "endMs": 3934.9, "symbol": "Eb", "harte": "Eb"}, {"startMs": 3934.9, "endMs": 4933.3, "symbol": "G/5", "harte": "G/5"}, {"startMs": 4933.3, "endMs": 8706.6, "symbol": "C", "harte": "C"}, {"startMs": 8706.6, "endMs": 12363.7, "symbol": "E:min/5", "harte": "E:min/5"}, {"startMs": 12363.7, "endMs": 16044.1, "symbol": "C:7", "harte": "C:7"}, {"startMs": 16044.1, "endMs": 18737.6, "symbol": "F", "harte": "F"}, {"startMs": 18737.6, "endMs": 19619.9, "symbol": "C/3", "harte": "C/3"}, {"startMs": 19619.9, "endMs": 23300.3, "symbol": "D", "harte": "D"}, {"startMs": 23300.3, "endMs": 24330.6, "symbol": "G", "harte": "G"}, {"startMs": 24330.6, "endMs": 25181.1, "symbol": "G:sus4(2)/2", "harte": "G:sus4(2)/2"}, {"startMs": 25181.1, "endMs": 27050.3, "symbol": "G/3", "harte": "G/3"}, {"startMs": 27050.3, "endMs": 28884.7, "symbol": "A:min", "harte": "A:min"}, {"startMs": 28884.7, "endMs": 30684.3, "symbol": "Ab:aug", "harte": "Ab:aug"}, {"startMs": 30684.3, "endMs": 32460.6, "symbol": "C/5", "harte": "C/5"}, {"startMs": 32460.6, "endMs": 34271.7, "symbol": "D:7", "harte": "D:7"}, {"startMs": 34271.7, "endMs": 36094.5, "symbol": "F", "harte": "F"}, {"startMs": 36094.5, "endMs": 37046.5, "symbol": "Eb", "harte": "Eb"}, {"startMs": 37046.5, "endMs": 37986.9, "symbol": "G/5", "harte": "G/5"}, {"startMs": 37986.9, "endMs": 41748.6, "symbol": "C", "harte": "C"}, {"startMs": 41748.6, "endMs": 45405.7, "symbol": "E:min/5", "harte": "E:min/5"}, {"startMs": 45405.7, "endMs": 49028.0, "symbol": "C:7", "harte": "C:7"}, {"startMs": 49028.0, "endMs": 51733.1, "symbol": "F", "harte": "F"}, {"startMs": 51733.1, "endMs": 52650.3, "symbol": "C/3", "harte": "C/3"}, {"startMs": 52650.3, "endMs": 56272.6, "symbol": "D", "harte": "D"}, {"startMs": 56272.6, "endMs": 57166.6, "symbol": "G", "harte": "G"}, {"startMs": 57166.6, "endMs": 58118.6, "symbol": "G:sus4(2)/2", "harte": "G:sus4(2)/2"}, {"startMs": 58118.6, "endMs": 59883.3, "symbol": "G/3", "harte": "G/3"}, {"startMs": 59883.3, "endMs": 61682.9, "symbol": "A:min", "harte": "A:min"}, {"startMs": 61682.9, "endMs": 63494.0, "symbol": "Ab:aug", "harte": "Ab:aug"}, {"startMs": 63494.0, "endMs": 65258.8, "symbol": "C/5", "harte": "C/5"}, {"startMs": 65258.8, "endMs": 67093.1, "symbol": "D:7", "harte": "D:7"}, {"startMs": 67093.1, "endMs": 68962.3, "symbol": "F", "harte": "F"}, {"startMs": 68962.3, "endMs": 69940.3, "symbol": "Eb", "harte": "Eb"}, {"startMs": 69940.3, "endMs": 70878.5, "symbol": "G/5", "harte": "G/5"}, {"startMs": 70878.5, "endMs": 74488.7, "symbol": "A", "harte": "A"}, {"startMs": 74488.7, "endMs": 76230.2, "symbol": "A", "harte": "A"}, {"startMs": 76230.2, "endMs": 77905.7, "symbol": "C#:min/5", "harte": "C#:min/5"}, {"startMs": 77905.7, "endMs": 79573.9, "symbol": "F#:min", "harte": "F#:min"}, {"startMs": 79573.9, "endMs": 81303.8, "symbol": "A/5", "harte": "A/5"}, {"startMs": 81303.8, "endMs": 82964.0, "symbol": "D", "harte": "D"}, {"startMs": 82964.0, "endMs": 84647.4, "symbol": "G", "harte": "G"}, {"startMs": 84647.4, "endMs": 85334.9, "symbol": "A", "harte": "A"}, {"startMs": 85334.9, "endMs": 86043.4, "symbol": "A/7", "harte": "A/7"}, {"startMs": 86043.4, "endMs": 86675.3, "symbol": "A/b7", "harte": "A/b7"}, {"startMs": 86675.3, "endMs": 87288.0, "symbol": "A/6", "harte": "A/6"}, {"startMs": 87288.0, "endMs": 87747.5, "symbol": "A/b6", "harte": "A/b6"}, {"startMs": 87747.5, "endMs": 88142.0, "symbol": "A/5", "harte": "A/5"}, {"startMs": 88142.0, "endMs": 89790.6, "symbol": "A", "harte": "A"}, {"startMs": 89790.6, "endMs": 91474.1, "symbol": "C#:min/5", "harte": "C#:min/5"}, {"startMs": 91474.1, "endMs": 93145.9, "symbol": "F#:min", "harte": "F#:min"}, {"startMs": 93145.9, "endMs": 94841.0, "symbol": "A/5", "harte": "A/5"}, {"startMs": 94841.0, "endMs": 96501.2, "symbol": "D", "harte": "D"}, {"startMs": 96501.2, "endMs": 98207.9, "symbol": "G", "harte": "G"}, {"startMs": 98207.9, "endMs": 98892.9, "symbol": "C", "harte": "C"}, {"startMs": 98892.9, "endMs": 99531.4, "symbol": "C/7", "harte": "C/7"}, {"startMs": 99531.4, "endMs": 100146.7, "symbol": "C/6", "harte": "C/6"}, {"startMs": 100146.7, "endMs": 100820.1, "symbol": "C/5", "harte": "C/5"}, {"startMs": 100820.1, "endMs": 101238.1, "symbol": "C/3", "harte": "C/3"}, {"startMs": 101238.1, "endMs": 101690.9, "symbol": "C/2", "harte": "C/2"}, {"startMs": 101690.9, "endMs": 105348.0, "symbol": "C", "harte": "C"}, {"startMs": 105348.0, "endMs": 108854.2, "symbol": "E:min/5", "harte": "E:min/5"}, {"startMs": 108854.2, "endMs": 112488.2, "symbol": "C:7", "harte": "C:7"}, {"startMs": 112488.2, "endMs": 115100.4, "symbol": "F", "harte": "F"}, {"startMs": 115100.4, "endMs": 115947.9, "symbol": "C/3", "harte": "C/3"}, {"startMs": 115947.9, "endMs": 119570.2, "symbol": "D", "harte": "D"}, {"startMs": 119570.2, "endMs": 120487.4, "symbol": "G", "harte": "G"}, {"startMs": 120487.4, "endMs": 121311.7, "symbol": "G:sus4(2)/2", "harte": "G:sus4(2)/2"}, {"startMs": 121311.7, "endMs": 123157.7, "symbol": "G/3", "harte": "G/3"}, {"startMs": 123157.7, "endMs": 124899.2, "symbol": "A:min", "harte": "A:min"}, {"startMs": 124899.2, "endMs": 126687.2, "symbol": "Ab:aug", "harte": "Ab:aug"}, {"startMs": 126687.2, "endMs": 128463.5, "symbol": "C/5", "harte": "C/5"}, {"startMs": 128463.5, "endMs": 130158.5, "symbol": "D:7", "harte": "D:7"}, {"startMs": 130158.5, "endMs": 132016.1, "symbol": "F", "harte": "F"}, {"startMs": 132016.1, "endMs": 132898.5, "symbol": "Eb", "harte": "Eb"}, {"startMs": 132898.5, "endMs": 133757.6, "symbol": "G/5", "harte": "G/5"}, {"startMs": 133757.6, "endMs": 137438.0, "symbol": "C", "harte": "C"}, {"startMs": 137438.0, "endMs": 141095.1, "symbol": "E:min/5", "harte": "E:min/5"}, {"startMs": 141095.1, "endMs": 144671.0, "symbol": "C:7", "harte": "C:7"}, {"startMs": 144671.0, "endMs": 147376.1, "symbol": "F", "harte": "F"}, {"startMs": 147376.1, "endMs": 148258.5, "symbol": "C/3", "harte": "C/3"}, {"startMs": 148258.5, "endMs": 151869.2, "symbol": "D", "harte": "D"}, {"startMs": 151869.2, "endMs": 152774.8, "symbol": "G", "harte": "G"}, {"startMs": 152774.8, "endMs": 153691.9, "symbol": "G:sus4(2)", "harte": "G:sus4(2)"}, {"startMs": 153691.9, "endMs": 155468.3, "symbol": "G/3", "harte": "G/3"}, {"startMs": 155468.3, "endMs": 157233.0, "symbol": "A:min", "harte": "A:min"}, {"startMs": 157233.0, "endMs": 158974.5, "symbol": "Ab:aug", "harte": "Ab:aug"}, {"startMs": 158974.5, "endMs": 160808.9, "symbol": "C/5", "harte": "C/5"}, {"startMs": 160808.9, "endMs": 162608.4, "symbol": "D:7", "harte": "D:7"}, {"startMs": 162608.4, "endMs": 164442.8, "symbol": "F", "harte": "F"}, {"startMs": 164442.8, "endMs": 165336.8, "symbol": "Eb", "harte": "Eb"}, {"startMs": 165336.8, "endMs": 166207.5, "symbol": "G/5", "harte": "G/5"}, {"startMs": 166207.5, "endMs": 169748.6, "symbol": "A", "harte": "A"}, {"startMs": 169748.6, "endMs": 171571.3, "symbol": "F", "harte": "F"}, {"startMs": 171571.3, "endMs": 172511.7, "symbol": "Eb", "harte": "Eb"}, {"startMs": 172511.7, "endMs": 173614.7, "symbol": "G/5", "harte": "G/5"}, {"startMs": 173614.7, "endMs": 178698.7, "symbol": "C", "harte": "C"}, {"startMs": 178698.7, "endMs": 182873.9, "symbol": "N.C.", "harte": "N"}], "keys": [], "tempo": [{"startMs": 0, "bpm": 66.7}], "edits": []}